{"artifact_type":"case","budgets":{"cost_microusd":0,"steps":20,"time_ms":30000,"tokens":0,"tool_calls":20,"turns":1},"capabilities":{"allowed":["effect.reconcile","escalation.create"],"prohibited":["effect.blind-retry"]},"case_id":"m0.healing-unknown-effect","case_version":1,"content_digest":"sha256:dc55bb1d510185812208f77ad303c4749cbef339de1e5a6931878bd3568f07f2","content_policy":{"capture":"metadata","classification":"public"},"definition_of_done":["The effect is reconciled or escalated without re-execution."],"digest_version":1,"environment":{"isolation":"subprocess","network":"denied","profile":"pr"},"evidence":{"optional":[],"required":[{"id":"evidence.08.01","kind":"receipt","oracle":"Effect journal contains no new attempt before reconciliation."}]},"format_version":1,"input":{"kind":"contract-scenario","payload":{"effect_status":"unknown","proposed_action":"retry"}},"purpose":"Keep bounded remediation from multiplying ambiguous external work.","references":[],"repetitions":{"comparison_method":"exact","count":1},"risk_class":"critical","scorers":[{"id":"tamoz.m0.contract","kind":"deterministic","version":"v1"}],"split":"adversarial","suite_id":"tamoz.m0.golden","tags":["adversarial","healing","invariant-33"],"title":"Self-healing never retries an unknown effect blindly"}
