{"artifact_type":"case","budgets":{"cost_microusd":0,"steps":1,"time_ms":30000,"tokens":0,"tool_calls":0,"turns":1},"capabilities":{"allowed":["test.execute"],"prohibited":["network.write","state.external-effect"]},"case_id":"m2.barrier-determinism","case_version":1,"content_digest":"sha256:14dfdfd664c969b83d887dc5f242cd32e1b8c3e7dc620eec7d8f0342df8a0d31","content_policy":{"capture":"metadata","classification":"public"},"definition_of_done":["The runtime matches an independent barrier reference model.","At least 100 varied threaded schedules produce byte-identical inline histories."],"digest_version":1,"environment":{"isolation":"sandbox","network":"denied","profile":"pr"},"evidence":{"optional":[],"required":[{"id":"m2.evidence.02","kind":"test","oracle":"The fixed M2 runner exits successfully and retains its complete output."}]},"format_version":1,"input":{"kind":"ruby-test-selection","payload":{"test_file":"test/graph_execution_test.rb,test/graph_state_manager_test.rb,test/graph_determinism_property_test.rb","test_pattern":"/./"}},"purpose":"Prove one frozen snapshot and ordered whole-batch reduction.","references":[],"repetitions":{"comparison_method":"exact","count":1},"risk_class":"critical","scorers":[{"id":"tamoz.m2.fixed-test","kind":"deterministic","version":"v1"}],"split":"conformance","suite_id":"tamoz.m2.graph","tags":["conformance","graph","m2-02"],"title":"Barrier execution is independent of worker completion timing"}
