{"artifact_type":"case","budgets":{"cost_microusd":0,"steps":20,"time_ms":30000,"tokens":0,"tool_calls":20,"turns":1},"capabilities":{"allowed":["stream.admit"],"prohibited":["stream.advance-conflict"]},"case_id":"m0.stream-event-admission","case_version":1,"content_digest":"sha256:9e9fa9d542c4ad51e114dd4d6f1fe9a3533eb064dece4879693b378628b6cf53","content_policy":{"capture":"metadata","classification":"public"},"definition_of_done":["The conflicting event is quarantined and the prior state remains current."],"digest_version":1,"environment":{"isolation":"subprocess","network":"denied","profile":"pr"},"evidence":{"optional":[],"required":[{"id":"evidence.10.01","kind":"state","oracle":"Admission history records identity scope, digest version, and quarantine."}]},"format_version":1,"input":{"kind":"contract-scenario","payload":{"same_id_different_hash":true,"source_authenticated":true}},"purpose":"Prevent forged or conflicting events from silently advancing Situation state.","references":[],"repetitions":{"comparison_method":"exact","count":1},"risk_class":"critical","scorers":[{"id":"tamoz.m0.contract","kind":"deterministic","version":"v1"}],"split":"conformance","suite_id":"tamoz.m0.golden","tags":["conformance","streaming","invariant-45"],"title":"Observations are authenticated, bounded, and digest-versioned"}
