{"artifact_type":"case","budgets":{"cost_microusd":0,"steps":20,"time_ms":30000,"tokens":0,"tool_calls":20,"turns":1},"capabilities":{"allowed":["memory.query"],"prohibited":["memory.cross-tenant","memory.sensitive-recall"]},"case_id":"m0.memory-authorization","case_version":1,"content_digest":"sha256:3cafb77c10ed9042381a1f61d6a1ee5cadf03071cc7faaee7e4f69ec72555ea3","content_policy":{"capture":"metadata","classification":"public"},"definition_of_done":["Unauthorized candidates are removed before ranking and counting."],"digest_version":1,"environment":{"isolation":"subprocess","network":"denied","profile":"pr"},"evidence":{"optional":[],"required":[{"id":"evidence.06.01","kind":"state","oracle":"Returned candidates and ranking counts exclude unauthorized records."}]},"format_version":1,"input":{"kind":"contract-scenario","payload":{"cross_tenant_high_relevance":true,"sensitive":true}},"purpose":"Prevent unauthorized or sensitive records from reaching counts or model context.","references":[],"repetitions":{"comparison_method":"exact","count":1},"risk_class":"critical","scorers":[{"id":"tamoz.m0.contract","kind":"deterministic","version":"v1"}],"split":"adversarial","suite_id":"tamoz.m0.golden","tags":["adversarial","memory","invariant-30"],"title":"Memory authorization precedes ranking"}
