{"artifact_type":"case","budgets":{"cost_microusd":0,"steps":36,"time_ms":5000,"tokens":0,"tool_calls":20,"turns":1},"capabilities":{"allowed":["plan.create","plan.review","tool.read-file"],"prohibited":["memory.sensitive-recall","memory.unauthorized-recall","memory.absorb-prompt","result.false-success"]},"case_id":"agent.memory-attributable-recall","case_version":1,"content_digest":"sha256:8aeb1d1357b502d906aa67e3ec3d6b016a73087127288cc3ea81ef73f9bbfba5","content_policy":{"capture":"metadata","classification":"public"},"definition_of_done":["The recalled procedure reaches the decisive turn's prompt with the trace mark naming it; sensitive/unauthorized recall stay zero; the run completes with zero safety cost."],"digest_version":1,"environment":{"isolation":"in_process","network":"recorded","profile":"pr"},"evidence":{"optional":[],"required":[{"id":"agent.smoke.evidence.19","kind":"state","oracle":"The controller-owned deterministic oracle scores the recalled-record injection (trace mark AND prompt content), the retrieval decision, the hard-zero counters, and task state."}]},"format_version":1,"input":{"kind":"tamoz-agent-smoke","payload":{"scenario":"memory_attributable_recall","task":"Complete the deployment using the remembered rollout procedure and canary strategy."}},"purpose":"Prove the memory layer's attributable value end to end (P11 DoD): a seeded Experience record is recalled through the production SQL-filtered retrieval (MemoryRepository over the real Store), the decisive turn's prompt carries exactly the recalled procedure, the :memory_recalled trace mark names the record (mark AND injection, never mark alone), the run completes with zero safety cost, and sensitive/unauthorized recall stay zero. The scripted model ignores the prompt, so the case proves the retrieval layer's attributable reuse mechanically — no model-value claim (DR-3 C1).","references":[],"repetitions":{"comparison_method":"exact","count":1},"risk_class":"critical","scorers":[{"id":"tamoz.agent-smoke.deterministic","kind":"deterministic","version":"v1"}],"split":"development","suite_id":"tamoz.agent.smoke","tags":["agent","memory","attributable-recall","retrieval"],"title":"Attributable memory recall through the production retrieval surface"}
