{"artifact_type":"case","budgets":{"cost_microusd":0,"steps":1,"time_ms":30000,"tokens":0,"tool_calls":0,"turns":1},"capabilities":{"allowed":["test.execute"],"prohibited":["network.write","state.external-effect"]},"case_id":"m2.interrupt-identity","case_version":1,"content_digest":"sha256:426977683485829867a37bd0dd57243eb15351cba400f44a742eac85a5026110","content_policy":{"capture":"metadata","classification":"public"},"definition_of_done":["Activation identity survives pause and retry while attempt identity changes.","Resume is positional, restarts from line one, and rejects stale or malformed answers."],"digest_version":1,"environment":{"isolation":"sandbox","network":"denied","profile":"pr"},"evidence":{"optional":[],"required":[{"id":"m2.evidence.03","kind":"test","oracle":"The fixed M2 runner exits successfully and retains its complete output."}]},"format_version":1,"input":{"kind":"ruby-test-selection","payload":{"test_file":"test/graph_identity_test.rb,test/graph_interrupt_test.rb","test_pattern":"/./"}},"purpose":"Prevent stale-result commits and repeated successful siblings.","references":[],"repetitions":{"comparison_method":"exact","count":1},"risk_class":"critical","scorers":[{"id":"tamoz.m2.fixed-test","kind":"deterministic","version":"v1"}],"split":"conformance","suite_id":"tamoz.m2.graph","tags":["conformance","graph","m2-03"],"title":"Interrupt, retry, and attempt identities preserve logical work"}
