{"artifact_type":"case","budgets":{"cost_microusd":0,"steps":1,"time_ms":30000,"tokens":0,"tool_calls":0,"turns":1},"capabilities":{"allowed":["test.execute"],"prohibited":["network.write","state.external-effect"]},"case_id":"m1.context-isolation","case_version":1,"content_digest":"sha256:50efe9f0cdeb39408cda1e42daa29b21da6ed9e83a21ac97d21e2da0ac36b26c","content_policy":{"capture":"metadata","classification":"public"},"definition_of_done":["Context values are copied and frozen while injected handles remain externally owned.","Cancellation, deadlines, child lineage, emission, and instrumentation are explicit."],"digest_version":1,"environment":{"isolation":"sandbox","network":"denied","profile":"pr"},"evidence":{"optional":[],"required":[{"id":"m1.evidence.02","kind":"test","oracle":"The fixed M1 runner exits successfully and retains its complete output."}]},"format_version":1,"input":{"kind":"ruby-test-selection","payload":{"test_file":"test/core_context_test.rb,test/core_instrumentation_test.rb","test_pattern":"/./"}},"purpose":"Prevent ambient tenant state and mutable metadata from crossing calls.","references":[],"repetitions":{"comparison_method":"exact","count":1},"risk_class":"critical","scorers":[{"id":"tamoz.m1.fixed-test","kind":"deterministic","version":"v1"}],"split":"conformance","suite_id":"tamoz.m1.core","tags":["conformance","core","m1-02"],"title":"Context carries explicit isolated identity and cooperative services"}
