{"artifact_type":"case","budgets":{"cost_microusd":0,"steps":20,"time_ms":30000,"tokens":0,"tool_calls":20,"turns":1},"capabilities":{"allowed":["inbox.enqueue","inbox.claim"],"prohibited":["request.duplicate-execution"]},"case_id":"m0.request-inbox-recovery","case_version":1,"content_digest":"sha256:3487213812a941fa05e3839a017bdec153ee6648c406451f43610211693ad3b5","content_policy":{"capture":"metadata","classification":"public"},"definition_of_done":["One row and one execution exist per request id.","FIFO queue order is preserved."],"digest_version":1,"environment":{"isolation":"subprocess","network":"denied","profile":"pr"},"evidence":{"optional":[],"required":[{"id":"evidence.03.01","kind":"state","oracle":"Inbox transition history matches the reference state machine."}]},"format_version":1,"input":{"kind":"contract-scenario","payload":{"duplicate_deliveries":20,"mode":"queue-and-redirect"}},"purpose":"Make duplicate surface delivery, queue ordering, and redirect recovery explicit.","references":[],"repetitions":{"comparison_method":"exact","count":1},"risk_class":"critical","scorers":[{"id":"tamoz.m0.contract","kind":"deterministic","version":"v1"}],"split":"conformance","suite_id":"tamoz.m0.golden","tags":["conformance","persistence","invariant-53"],"title":"Durable request inbox preserves identity and order"}
