{"artifact_type":"case","budgets":{"cost_microusd":0,"steps":1,"time_ms":30000,"tokens":0,"tool_calls":0,"turns":1},"capabilities":{"allowed":["test.execute"],"prohibited":["network.write","state.external-effect"]},"case_id":"m1.ordered-pool","case_version":1,"content_digest":"sha256:2a00a42ec316c1e144d698c7a46b72726518f7a997c18472f24872ba81a08144","content_policy":{"capture":"metadata","classification":"public"},"definition_of_done":["Submission order determines result order.","Interrupts, failures, cancellation, stuck workers, and fatal errors stay distinct."],"digest_version":1,"environment":{"isolation":"sandbox","network":"denied","profile":"pr"},"evidence":{"optional":[],"required":[{"id":"m1.evidence.03","kind":"test","oracle":"The fixed M1 runner exits successfully and retains its complete output."}]},"format_version":1,"input":{"kind":"ruby-test-selection","payload":{"test_file":"test/core_pool_test.rb","test_pattern":"/./"}},"purpose":"Make completion timing irrelevant without unsafe Ruby thread termination.","references":[],"repetitions":{"comparison_method":"exact","count":1},"risk_class":"critical","scorers":[{"id":"tamoz.m1.fixed-test","kind":"deterministic","version":"v1"}],"split":"conformance","suite_id":"tamoz.m1.core","tags":["conformance","core","m1-03"],"title":"Inline and threaded pools return one ordered typed result model"}
