{"artifact_type":"case","budgets":{"cost_microusd":0,"steps":20,"time_ms":30000,"tokens":0,"tool_calls":20,"turns":1},"capabilities":{"allowed":["runtime.execute"],"prohibited":["effect.unsafe"]},"case_id":"m0.activation-attempt-identity","case_version":1,"content_digest":"sha256:401f30c6ea9da1015acacc9eef83af90eb99de0df348151563c756dcb31c28bf","content_policy":{"capture":"metadata","classification":"public"},"definition_of_done":["Activation identity remains stable.","Attempt identity and base checkpoint change.","A successful sibling is not invoked again."],"digest_version":1,"environment":{"isolation":"subprocess","network":"denied","profile":"pr"},"evidence":{"optional":[],"required":[{"id":"evidence.02.01","kind":"event","oracle":"Task events show one activation and distinct attempts."},{"id":"evidence.02.02","kind":"receipt","oracle":"Effect identity is unchanged across attempts."}]},"format_version":1,"input":{"kind":"contract-scenario","payload":{"interrupt":true,"lease_takeover":true,"retry":true}},"purpose":"Prevent resume mismatches, repeated siblings, and duplicated effect identities.","references":[],"repetitions":{"comparison_method":"exact","count":1},"risk_class":"critical","scorers":[{"id":"tamoz.m0.contract","kind":"deterministic","version":"v1"}],"split":"conformance","suite_id":"tamoz.m0.golden","tags":["conformance","graph","invariant-52"],"title":"Logical activation survives retry and interruption"}
