{"artifact_type":"case","budgets":{"cost_microusd":0,"steps":36,"time_ms":5000,"tokens":0,"tool_calls":20,"turns":1},"capabilities":{"allowed":["eval.scorecard-agent-smoke"],"prohibited":["scheduler.duplicate-turn","scheduler.grant-widening","scheduler.false-success","scheduler.unbounded-backlog"]},"case_id":"agent.schedule-materialization","case_version":1,"content_digest":"sha256:a53e1474d532249ca0cb5c2bdd57da8f188302b40c95cde38884f2a4cdc1ef9e","content_policy":{"capture":"metadata","classification":"public"},"definition_of_done":["The interval schedule materializes one occurrence per cadence into the request inbox; a repeated poll and a post-restart poll add zero duplicates; a revoked grant skips with grant_revoked history; delivery is never execution success; zero safety cost."],"digest_version":1,"environment":{"isolation":"in_process","network":"recorded","profile":"pr"},"evidence":{"optional":[],"required":[{"id":"agent.smoke.evidence.21","kind":"state","oracle":"The controller-owned deterministic oracle scores the occurrence count per cadence, the deterministic request id dedup across a restart, the revoked-grant skip, the delivery-vs-execution status separation, and the hard-zero counters."}]},"format_version":1,"input":{"kind":"tamoz-agent-smoke","payload":{"scenario":"schedule_materialization","task":"Materialize the scheduled read-only task once per logical occurrence."}},"purpose":"Prove the P13 durable-scheduling product consumer (P13-P/C8): an interval schedule for the READ-ONLY scorecard summary materializes into the ordinary durable request inbox through the REAL SQLite ScheduleStore, exactly one logical occurrence per cadence, with a deterministic request id (invariant 38 duplicate-turn hard zero), the claim-time grant intersection (invariant 40) refusing a revoked grant, a kill-at-seam proof with zero duplicate logical turns after a restart, and the delivery/execution status separation (the enqueued occurrence is delivery, never execution success). The consumer grant carries ONLY the read-only scorecard capability; no mutation tool, zero safety cost.","references":[],"repetitions":{"comparison_method":"exact","count":1},"risk_class":"critical","scorers":[{"id":"tamoz.agent-smoke.deterministic","kind":"deterministic","version":"v1"}],"split":"development","suite_id":"tamoz.agent.smoke","tags":["agent","scheduler","materialization","durability"],"title":"One recurring read-only task materializes exactly once per logical occurrence"}
